seg_id,sentence,adverb_pre_mapping,verb_pre_mapping,clustered_verb,clustered_adverb,start_time,end_time,duration,rgb_frames,flow_frames,adverb_label,verb_label,verb_adv_label
l2D6EupMK5c_26-35,finely chop garlic chopped till,finely,chop,chop,finely,26.1,35,8.9,225,224,2,1,18
YqGLgcnP2HQ_307-314,gently push,gently,push,push,gently,307.7,314,6.3,212,211,0,10,50
M8QOazlE9FY_225-246,gently roll phyllo dough rolling carpet,gently,roll,roll,gently,225.8,246.6,20.8,630,629,0,6,19
ja6Qdy6Sa-U_139-144,yolk egg lightly beat,lightly,beat,beat,gently,139.5,144.9,5.4,125,124,0,14,79
7AWXTW5af34_130-136,gently wrap form nice big,gently,wrap,wrap,gently,130.2,136.4,6.2,150,149,0,17,89
c1MBGKaEn5Y_556-567,hair towel gently wash hair shampoo conditioner,gently,wash,wash,gently,556.5,567.5,10.9,330,329,0,39,47
e1MdbsPSBo0_224-230,gently drip,gently,drip,drip,gently,224.5,230.6,6.1,182,181,0,43,175
BtqBAmWG_gI_25-31,liquid totally fine gently mash,gently,mash,mash,gently,25.4,31.9,6.5,144,143,0,34,81
_mqvaJP0pUw_59-64,gently spread 1 2,gently,spread,spread,gently,59.4,64.7,5.3,151,150,0,13,57
LH4EICbQmB0_282-287,peel gently,gently,peel,peel,gently,282.1,287.6,5.5,125,124,0,18,15
HDe9wItM-Y0_408-414,tastes cheese lightly toss,lightly,toss,toss,gently,408.6,414.2,5.7,150,149,0,12,16
2Yu05jm9-HU_499-505,bitchin hot pour slowly cake absorb goes,slowly,pour,pour,slowly,499.8,505.3,5.5,179,178,1,3,11
FPe2ufiQK1Q_74-82,finely chop,finely,chop,chop,finely,74.1,82.3,8.2,201,200,2,1,18
izpubI4Txhw_391-400,gently press cake,gently,press,press,gently,391.2,400.8,9.5,271,270,0,4,3
ca4baUj509s_135-144,add oil heating chop onion finely,finely,chop,chop,finely,135.6,144,8.4,225,224,2,1,18
Rvp-5EJb-Uw_221-227,cover paper towel gently press meat remove excess liquid,gently,cover,cover,gently,221.6,227.4,5.7,180,179,0,9,14
stAlxoML19w_1003-1021,gently stirring starts bubble,gently,stir,stir,gently,1003.6,1021.6,17.9,540,539,0,2,9
Rg0kCTV6dWY_191-205,mixture slowly mix spoon delicious,slowly,mix,mix,slowly,191.8,205.6,13.8,350,349,1,0,48
Yy_7jHoWqhA_115-122,use tongs gently mix pasta coated sauce,gently,mix,mix,gently,115.4,122.2,6.8,175,174,0,0,7
5qCOPUgOOC0_53-62,finely chop onion,finely,chop,chop,finely,53.8,62.8,9,225,224,2,1,18
kZVp3U73j9o_158-169,mix gently,gently,mix,mix,gently,158.1,169,10.9,264,263,0,0,7
xza5ANC08OU_517-524,frothy pastry brush lightly brush berries,lightly,brush,brush,gently,517.6,524.7,7.1,175,174,0,8,49
WYbPL0Qtavk_394-400,got consistency double cream gently whisk,gently,whisk,whisk,gently,394.5,400.6,6.1,180,179,0,7,17
156Cf9NPcy4_140-147,milk egg lightly brush,lightly,brush,brush,gently,141,147.6,6.6,175,174,0,8,49
ZbtXhfJXHZQ_186-200,folding gently volume,gently,fold,fold,gently,186.3,200.2,13.8,420,419,0,5,5
m_A2O7Cfblw_292-297,gently fold,gently,fold,fold,gently,292,297.9,5.9,150,149,0,5,5
2mukOt08S9E_121-127,salt stir lightly,lightly,stir,stir,gently,121.1,127.8,6.7,144,143,0,2,9
3yi2kQgtOLo_261-269,slowly pour milk syrup mixture mixing,slowly,pour,pour,slowly,261.3,269.6,8.3,200,199,1,3,11
-MKB2pxbsRM_289-297,slowly dip tip tomato,slowly,dip,dip,slowly,289.6,297.9,8.2,240,239,1,31,26
VocUzFjxO3E_91-100,chop onion chop roughly,roughly,chop,chop,coarsely,91.5,100.2,8.7,226,225,4,1,6
hBRIiGpTeRE_169-181,gently fold half cup,gently,fold,fold,gently,170,181.9,11.9,290,289,0,5,5
9eO6BKc0rBs_782-790,gently spread keg,gently,spread,spread,gently,782.5,790.5,8,240,239,0,13,57
nyJ75T68PEY_703-709,drop soup drop egg gently stir,gently,stir,stir,gently,703.6,709.9,6.3,146,145,0,2,9
E4FKfvUtfMM_319-333,spread thinly,thinly,spread,spread,finely,319.5,333.8,14.3,421,420,2,13,83
xw_R5aY4fuQ_9-14,palms lightly pat,lightly,pat,pat,gently,9.3,14.4,5.2,150,149,0,30,23
7Jku6UTCz5I_129-135,go run gotta mix slowly,slowly,mix,mix,slowly,129.6,135.8,6.2,180,179,1,0,48
IiK4IQzdyRM_356-365,lightly scrape super,lightly,scrape,scrape,gently,356.5,365.4,8.9,270,269,0,27,55
cShWN2soeFM_476-502,small spoon gently push ice cream,gently,push,push,gently,476.9,502.6,25.8,781,780,0,10,50
IZuBtXICDgM_262-271,letting drip slowly,slowly,drip,drip,slowly,263,271.1,8.1,269,268,1,43,76
94_1bKJdj7o_258-266,orange pink frosting yellow goes press gently,gently,press,press,gently,258.8,266.3,7.5,192,191,0,4,3
PyRad0KmTts_35-43,melt under low heat set aside finely chop garlic spring,finely,chop,chop,finely,35.6,43.6,7.9,241,240,2,1,18
V7RZSDyI_Uk_179-186,spread slice slowly spread cake using,slowly,spread,spread,slowly,180,186.3,6.3,170,169,1,13,121
S8xv5HNewjI_175-183,tablespoon water activate perfect quickly mix,quickly,mix,mix,quickly,175.9,183.9,8,242,241,3,0,34
2Zww07tieLI_783-788,garlic salt lightly mix cheddar monterey jack cheese,lightly,mix,mix,gently,783,788.9,5.9,152,151,0,0,7
4VQO-DRzoog_342-348,gently push place rush,gently,push,push,gently,342.8,348.6,5.8,182,181,0,10,50
5HrxRg3y214_32-54,finely chop chinese chai,finely,chop,chop,finely,32.7,54.5,21.9,528,527,2,1,18
9IVUFxDuDuQ_129-134,slowly stir,slowly,stir,stir,slowly,129.3,134.8,5.5,151,150,1,2,59
3-_ZZmAWe9M_148-164,grills slowly stir stop,slowly,stir,stir,slowly,148.3,164.5,16.2,481,480,1,2,59
0XSqtr9B4_c_721-727,cups milk stir time adding milk pour slowly,slowly,pour,pour,slowly,721.1,727.8,6.7,180,179,1,3,11
pCMNtcaNNeU_173-190,tofu stir gently,gently,stir,stir,gently,173.6,190.1,16.6,512,511,0,2,9
sMOUNNDtnA8_99-104,roughly chop peppers into,roughly,chop,chop,coarsely,99.1,104.6,5.5,125,124,4,1,6
B9rlzzw8UaA_952-959,sort lightly brush get drips butter butter,lightly,brush,brush,gently,952,959.5,7.5,175,174,0,8,49
4ZD5BLvTS8o_316-322,drizzle slowly into caramel cream mixture continue whipping minutes whip,slowly,drizzle,drizzle,slowly,316.3,322,5.7,181,180,1,21,2
FVvwaibaWeM_295-304,gently coat,gently,coat,coat,gently,295.9,304.9,9,270,269,0,15,33
_yZ44VE0liY_343-348,glue press gently,gently,press,press,gently,343.4,348.5,5.1,151,150,0,4,3
6h03CPqHVJs_68-73,use fingertips gently pat,gently,pat,pat,gently,68.6,73.7,5.1,126,125,0,30,23
Vw-fn0LAgPE_112-119,dry ingredients slowly pour wet mix,slowly,pour,pour,slowly,112.5,119.3,6.8,168,167,1,3,11
0folcRXIyvI_170-178,gently cut half,gently,cut,cut,gently,170.5,179,8.5,241,240,0,11,25
LYIVXSn9NeA_546-551,spoon gently into greased ramekin dishes little,gently,spoon,spoon,gently,546.4,551.6,5.2,125,124,0,25,10
mwSi1PpYmgQ_141-148,corners aside gently press,gently,press,press,gently,141.6,148.5,6.9,176,175,0,4,3
0d2_xHVd5eA_372-381,quickly chop potatoes half way,quickly,chop,chop,quickly,372.9,381.5,8.6,270,269,3,1,63
4cK69m5ZpPw_254-262,cup heavy cream gently pour mix,gently,pour,pour,gently,254.2,262.5,8.3,240,239,0,3,13
bSrwzDgrrF4_141-146,gently fold,gently,fold,fold,gently,141.3,146.9,5.6,152,151,0,5,5
n-WoWSMPnYw_711-719,brush lightly little milk,lightly,brush,brush,gently,711.6,719.9,8.3,192,191,0,8,49
zT6HG11bmuI_127-133,2 large red onions couple garlic cloves roughly chop,roughly,chop,chop,coarsely,127.1,133.6,6.5,180,179,4,1,6
Re8BtO_e0Q8_279-286,press lightly spatula flip,lightly,press,press,gently,279.3,286.5,7.2,210,209,0,4,3
L8LVaAcOBhk_366-372,real titties slowly roll ribbons,slowly,roll,roll,slowly,367,372.4,5.4,179,178,1,6,39
qM2sRSrArK4_195-203,thinly spreading pulling,thinly,spread,spread,finely,195.9,203.3,7.3,240,239,2,13,83
CiwZLmjF40w_196-203,mix gently ingredients combined mix,gently,mix,mix,gently,196.1,203.3,7.2,210,209,0,0,7
AYc-CCBal24_267-276,spatula fingers lightly flip,lightly,flip,flip,gently,267.5,276.1,8.5,271,270,0,19,36
za8RnE2SSKQ_72-82,spoon couscous into pot boiling vegetable broth lightly stir,lightly,stir,stir,gently,72.9,82.7,9.8,300,299,0,2,9
YpalPz2RAmo_86-94,plate lightly spray,lightly,spray,spray,gently,86.9,94.6,7.7,241,240,0,23,43
2_KYRaW-k5w_925-939,quickly mix leave,quickly,mix,mix,quickly,925.2,939.8,14.7,351,350,3,0,34
mO_qQJeogM8_601-607,processor finely chop carrots,finely,chop,chop,finely,601.8,607.9,6.1,150,149,2,1,18
tTuYSjmFaMQ_871-877,push gently push center pusher middle remove,gently,push,push,gently,871.7,877.4,5.7,150,149,0,10,50
8DE2T5gcACI_671-678,case half half gently mix overwork,gently,mix,mix,gently,671.9,678.2,6.3,210,209,0,0,7
fv3c8dnDRBw_14-27,mashing banana roughly,roughly,mash,mash,coarsely,14.3,27.2,12.9,390,389,4,34,120
58bJYCeabDs_119-126,mix add half flour mixture combine slowly add rest,slowly,mix,mix,slowly,119.4,126.2,6.9,210,209,1,0,48
qlOpryRGvNI_196-202,consistency stirring briskly oil,briskly,stir,stir,quickly,196.7,202.2,5.5,179,178,3,2,20
7Az4UKg--JA_308-318,gently peel,gently,peel,peel,gently,308.9,318.5,9.6,300,299,0,18,15
hrO9sNI0Lxg_193-208,make fancy plating using large cookie cutter plate fill salad pack slowly remove cookie cutter,slowly,fill,fill,slowly,193.7,209,15.2,451,450,1,28,64
mjRPIsp7dIs_215-225,allows bird finally crisp add foil loosely cover,loosely,cover,cover,loosely,215.6,225.8,10.2,300,299,8,9,107
QHd32H5Rc9w_76-81,sabayon hesitate mix vigorously 8 10 minutes exceeding,vigorously,mix,mix,vigorously,76.4,81.9,5.5,126,125,6,0,109
h-B70mvjcks_502-511,little little shot gently folding dry,gently,fold,fold,gently,502.3,512,9.6,216,215,0,5,5
ToXneuT2p4Y_123-128,gently pressing fans,gently,press,press,gently,123.1,128.4,5.2,150,149,0,4,3
V-9ZLTK5PsA_151-160,essence mix gently,gently,mix,mix,gently,151.4,160.1,8.7,226,225,0,0,7
BTwoj1ydf0c_180-186,separate strips into separate strips quickly pick,quickly,separate,separate,quickly,180.4,186.9,6.5,181,180,3,38,130
JnoFepeVLq4_91-102,into chunks finely chop ginger garlic onion heat,finely,chop,chop,finely,91.2,102.2,11,329,328,2,1,18
7pk5RJ5vLTc_483-499,gently fold egg whites,gently,fold,fold,gently,483.1,499.3,16.2,480,479,0,5,5
qr6pFPLWQqo_681-692,lightly coat cake,lightly,coat,coat,gently,681.4,692.4,11,276,275,0,15,33
uOUgWdqyWNE_1175-1190,scream matter tightly wrap,tightly,wrap,wrap,tightly,1175,1190.4,15.3,450,449,5,17,29
jvPetabWeik_133-142,roughly chop capers,roughly,chop,chop,coarsely,133.5,142.9,9.4,225,224,4,1,6
tfXFKIQ10ro_396-403,gently stir get blueberries coated,gently,stir,stir,gently,396.8,403.4,6.6,210,209,0,2,9
x_oGmS9MDWE_42-48,remove seeds roughly chop,roughly,chop,chop,coarsely,42.5,48.5,6,181,180,4,1,6
Sm9lac5Jhpw_470-478,tightly roll,tightly,roll,roll,tightly,470.6,478.4,7.8,240,239,5,6,42
e3Y7ghGOYB8_159-177,pour slowly whisk,slowly,pour,pour,slowly,159.8,177.2,17.4,451,450,1,3,11
Do4jvVRJxcY_189-197,recipe vinaigrette slowly drizzle,slowly,drizzle,drizzle,slowly,189.4,197.4,8,241,240,1,21,2
aKv02r6ERKs_27-34,mash lightly fork bowl,lightly,mash,mash,gently,27.7,35,7.3,169,168,0,34,81
25-vovSk5XU_170-176,gently roll sushi mat seaweed trying ingredients center,gently,roll,roll,gently,170.9,176.7,5.8,180,179,0,6,19
AZZHu7eH9O8_307-312,gently stir sauce into,gently,stir,stir,gently,307.3,312.9,5.6,150,149,0,2,9
VURpKevRdpI_135-143,chill 5 minutes lightly roll,lightly,roll,roll,gently,135.8,143.1,7.4,240,239,0,6,19
ZKnrRIsJMRE_201-206,gently pressing end,gently,press,press,gently,201.2,206.6,5.5,151,150,0,4,3
hlHiolQ9vEs_280-285,sides quickly wrap,quickly,wrap,wrap,quickly,280.2,285.6,5.4,120,119,3,17,179
Ik_OwFvklJo_340-346,minutes slowly whisk milk,slowly,whisk,whisk,slowly,340,346.7,6.7,180,179,1,7,32
Y2ikHLeYPN0_160-165,mix slowly,slowly,mix,mix,slowly,160,165.4,5.4,152,151,1,0,48
c8wXIpFUhtE_232-239,press lightly,lightly,press,press,gently,232.4,239.1,6.7,175,174,0,4,3
htoSNoOEQMM_64-70,gently fold batter got muffins,gently,fold,fold,gently,64.4,70.5,6.1,180,179,0,5,5
JQ3V9P-SVsY_295-302,use brush lightly oil leftover bacon drippings,lightly,brush,brush,gently,295.6,302.2,6.6,209,208,0,8,49
xwyrWsA-2YQ_262-273,coat ball dry flour roll bhatura thinly parantha,thinly,coat,coat,finely,262.2,273.2,11,330,329,2,15,184
vVgi8ICqhc8_132-138,mixture slowly fold folding,slowly,fold,fold,slowly,132.2,138.8,6.5,179,178,1,5,97
j8JzjOiRuHk_187-194,gently pour batter,gently,pour,pour,gently,187.6,194.7,7.1,211,210,0,3,13
Tnmd3VJPdyw_200-207,minute gently press veggies,gently,press,press,gently,200.3,207.4,7,209,208,0,4,3
0hAnKcKYWFk_71-78,roll thinly,thinly,roll,roll,finely,71.8,78.1,6.3,211,210,2,6,68
0uNuKVgAyW4_197-203,crumble sponge cake add halves oreo cookies finely mash,finely,mash,mash,finely,197,204,6.9,150,149,2,34,74
Ik4i7LoZhro_405-412,end oily chips spread lightly,lightly,spread,spread,gently,405.6,412.3,6.7,168,167,0,13,57
FAJj_4qZzRU_489-499,chopping finely,finely,chop,chop,finely,489.5,499.2,9.8,302,301,2,1,18
xanDq4a622o_161-167,consistency adding buttermilk slowly pour,slowly,pour,pour,slowly,161.7,167.8,6.1,180,179,1,3,11
-A71Hau0etE_232-249,remaining half tub mascarpone cheese whisking gently,gently,whisk,whisk,gently,232.7,249.6,16.8,409,408,0,7,17
otMqOkHs-ys_184-197,sheet aluminum foil cover start rolling gently remove sheet,gently,roll,roll,gently,184.8,197.1,12.3,391,390,0,6,19
hKffwnCp4Vc_68-75,talk flip combine gently press,gently,press,press,gently,68.9,75.1,6.2,212,211,0,4,3
hSsTD2gKf2g_117-123,mixture batches folding gently,gently,fold,fold,gently,117.4,123.2,5.9,180,179,0,5,5
XbHw6vArAWk_138-147,time twist left hand gently squeeze bag,gently,squeeze,squeeze,gently,138.4,147.2,8.8,225,224,0,16,12
W5ePa4lKkaM_82-92,whisking whisking vigorously leave little pathway little,vigorously,whisk,whisk,vigorously,82.2,92.5,10.3,300,299,6,7,1
7MJPs0_2Zrs_287-308,gently spread cake,gently,spread,spread,gently,287.1,308.7,21.6,631,630,0,13,57
z77G_7A3UpM_271-276,wooden spoon stir stick thickly spoon,thickly,stir,stir,coarsely,271.2,277,5.8,126,125,4,2,140
GjWD2HaB2BA_101-109,meat leg taking time gently peeling,gently,peel,peel,gently,101.2,109.1,7.8,242,241,0,18,15
cJYsmxFhgCQ_422-428,using bench scraper lightly pressing lines,lightly,press,press,gently,422.3,428.3,6,181,180,0,4,3
DzQZ029fJ5o_140-149,pin gently roll,gently,roll,roll,gently,140.5,149.4,8.9,225,224,0,6,19
gnr0VoBDNV8_123-128,quickly chop into 16 pieces dive cut half,quickly,chop,chop,quickly,123.4,128.5,5.1,119,118,3,1,63
pGlTwbs3N0M_111-119,make wedge pour slowly,slowly,pour,pour,slowly,111.1,119.4,8.3,241,240,1,3,11
m1fpglXwO7g_200-208,quickly pour into flour,quickly,pour,pour,quickly,200.8,208.4,7.6,240,239,3,3,66
H7Ic0fyMSQg_254-262,press gently stuffing spread evenly,gently,press,press,gently,254.5,262.7,8.2,241,240,0,4,3
DLBrc2yrR_I_182-188,whisk mixture slowly pour milk cream,slowly,whisk,whisk,slowly,182.7,188.5,5.8,180,179,1,7,32
T4G00yfPJ5M_650-656,loosely wrap foil,loosely,wrap,wrap,loosely,650.6,656.7,6.1,150,149,8,17,144
seRQjHKxHf8_91-96,continue whisking slowly pour juice stock mixture bring boil,slowly,whisk,whisk,slowly,91.2,96.8,5.6,151,150,1,7,32
FsfXheYWats_185-192,creep edges delicately flip,delicately,flip,flip,gently,186,192.3,6.3,210,209,0,19,36
mPQCFbxCsoI_246-252,step finely chop,finely,chop,chop,finely,246.3,252.4,6.2,180,179,2,1,18
FmavyOIQIz0_109-116,remember seal bag tightly,tightly,seal,seal,tightly,110,116.8,6.8,210,209,5,36,70
ga15SvcDECE_447-454,rolling pretty quickly pressing,quickly,roll,roll,quickly,447,454.8,7.8,168,167,3,6,96
Q6lTrzdYV6M_80-86,make mit mix slowly,slowly,mix,mix,slowly,80.5,86,5.6,181,180,1,0,48
Nrw4J7SWKGA_369-377,sort gently toss,gently,toss,toss,gently,369.4,377.3,7.8,201,200,0,12,16
3mtAqWjJxGg_264-272,gently brush,gently,brush,brush,gently,264.5,272.2,7.6,200,199,0,8,49
Hy7LeYAJplk_168-176,finely chop handful fresh parsley,finely,chop,chop,finely,168.9,176.1,7.2,240,239,2,1,18
Slsk6ULa5YM_349-357,add cup cold water gently stir,gently,stir,stir,gently,349.1,357.3,8.2,240,239,0,2,9
Ttye2BtnW_s_248-257,tin plum tomatoes roughly chop tomato puree,roughly,chop,chop,coarsely,248.8,257.7,9,226,225,4,1,6
UX76kIUI09k_220-226,finely mince,finely,mince,mince,finely,220.5,226.2,5.8,181,180,2,26,0
BWcPc7vf8IE_124-131,surface lightly fold,lightly,fold,fold,gently,124.9,131.7,6.8,211,210,0,5,5
eF_QwDEx_NE_101-109,tablespoons freshly squeezed lemon juice gently toss,gently,toss,toss,gently,101.6,109,7.4,242,241,0,12,16
BmEwZK3y2Yg_324-330,gently pressing dough,gently,press,press,gently,324.4,331,6.5,151,150,0,4,3
FNkwlU7sy-4_91-97,loosely cover plastic wrap,loosely,cover,cover,loosely,91.9,97.1,5.2,180,179,8,9,107
pZcT947VqPs_228-239,gently rub chicken marinade,gently,rub,rub,gently,228.2,239.8,11.6,329,328,0,22,21
pb5PFU0ejkI_167-173,m whisk quickly m add quarter teaspoon,quickly,whisk,whisk,quickly,167.1,173.8,6.8,145,144,3,7,102
1lg_bSa7FlE_363-373,slowly pour syrup,slowly,pour,pour,slowly,363.8,373.3,9.5,250,249,1,3,11
12xBWotWWTQ_109-115,lift whisk batter thick dripping slowly,slowly,drip,drip,slowly,110,115.5,5.5,180,179,1,43,76
4vwVfdMn9Pw_178-185,mixture pour eggs slowly,slowly,pour,pour,slowly,178.5,185.6,7.1,176,175,1,3,11
u_KuBdh9JoY_93-98,good stir chop nuts coarsely,coarsely,chop,chop,coarsely,93.2,98.4,5.2,150,149,4,1,6
iH6PwqJY3yQ_1178-1186,time teaspoon good whisk gently,gently,whisk,whisk,gently,1178.4,1186.6,8.2,201,200,0,7,17
YPBF-ymcHrc_860-866,lightly drizzle nice quality olive oil nice pretty,lightly,drizzle,drizzle,gently,860.6,866.7,6.1,180,179,0,21,137
ZtB21K4V-FE_88-95,onion roughly chop,roughly,chop,chop,coarsely,88.4,96,7.5,175,174,4,1,6
rgRLyGjKNuY_216-229,press lightly remove tip cheesecake mixture jar,lightly,press,press,gently,216.4,229.7,13.2,325,324,0,4,3
MvJMG2SARh4_185-193,season salt gently mix,gently,mix,mix,gently,185.4,193.8,8.4,193,192,0,0,7
SeofdmWRQds_316-325,roll tightly,tightly,roll,roll,tightly,316.3,325.5,9.2,270,269,5,6,42
ifk0aqE9zT0_63-71,get double layered ziploc bag gently pour,gently,pour,pour,gently,63.6,71.1,7.5,242,241,0,3,13
FW7dlHoxL4E_174-202,quickly whisk whis stop whisking who's coal salt,quickly,whisk,whisk,quickly,174.4,202.9,28.5,840,839,3,7,102
eZU5kXhvVug_273-280,slowly beat,slowly,beat,beat,slowly,273.4,280.9,7.4,169,168,1,14,67
VhIUc0G9ZEM_161-184,start stirring stir quickly,quickly,stir,stir,quickly,161.2,184.5,23.3,689,688,3,2,20
0D13r41lMtg_74-79,rest walnut mixture batter press gently walnut,gently,press,press,gently,74.2,79.6,5.5,150,149,0,4,3
AsvU7Cbz2oA_151-168,cover lightly sprinkle gives nice hot flavor,lightly,cover,cover,gently,151.3,168.5,17.1,510,509,0,9,14
JjYn7Uv-BQw_1089-1105,lot flavor rice quickly stir,quickly,stir,stir,quickly,1089.1,1105.2,16.1,400,399,3,2,20
-mUnmwU0BKY_96-103,chop finely,finely,chop,chop,finely,96.7,103.1,6.4,176,175,2,1,18
rtGA8Fg5TiU_110-116,finely chop,finely,chop,chop,finely,110.6,116.7,6.1,181,180,2,1,18
saQENzNtblo_165-175,season gently salt,gently,season,season,gently,165.4,175,9.6,299,298,0,35,38
FnEtQo0pc28_108-137,slowly pour into,slowly,pour,pour,slowly,108.8,137.5,28.8,697,696,1,3,11
j4WShsIUWDA_229-234,honey mmm think gently toss wow,gently,toss,toss,gently,229.3,234.6,5.3,120,119,0,12,16
VzIv4KxX-yU_53-61,good stir minute add ginger garlic paste quickly stir,quickly,stir,stir,quickly,53.6,61.3,7.7,240,239,3,2,20
8seT960Grr4_186-193,purpose flour small portion start rolling gently,gently,roll,roll,gently,186.5,193.2,6.6,211,210,0,6,19
jdPObaUHnuU_340-436,fold dough lightly round final,lightly,fold,fold,gently,380,440,61,600,599,0,5,5
vDzJB2VNLzA_177-187,way finely mince cilantro,finely,mince,mince,finely,177.9,188,10.1,302,301,2,26,0
uSxfKLUG5g0_137-144,chop coarsely chop,coarsely,chop,chop,coarsely,137.8,144.4,6.7,176,175,4,1,6
6fY7W5CrCVA_54-59,stirring quickly pasta,quickly,stir,stir,quickly,54.2,59.4,5.1,121,120,3,2,20
nN8YutYc_Z8_260-266,stir gently mixing gravy eggplant,gently,mix,mix,gently,260.7,266.8,6.1,182,181,0,0,7
jqpmtYMD-30_139-152,stir slowly stirring,slowly,stir,stir,slowly,139.3,152.1,12.7,390,389,1,2,59
Uqt8eX6CvN8_502-511,cut slowly patient,slowly,cut,cut,slowly,502.9,511.3,8.5,217,216,1,11,78
LWS7dhHC4h8_1220-1226,soap stick press gently what's,gently,press,press,gently,1220.5,1226.6,6.1,145,144,0,4,3
ZJHHOnhdh_4_240-246,warm milk quickly stir scramble eggs,quickly,stir,stir,quickly,240.6,246.9,6.2,180,179,3,2,20
RPzn0jxDVdk_117-123,roughly chop strawberries,roughly,chop,chop,coarsely,117.1,123.5,6.4,180,179,4,1,6
gfMbzfwm_ME_21-30,grate inch piece ginger finely,finely,grate,grate,finely,21.8,30.7,8.9,270,269,2,41,71
JYQhLQ8j1mc_285-295,quickly stir added unexpected femur pour,quickly,stir,stir,quickly,285.4,295.4,10,239,238,3,2,20
Zsk_dFkavCc_818-826,gently spread,gently,spread,spread,gently,818.9,826.8,7.9,200,199,0,13,57
G6TGHznzQ04_187-194,slowly fill,slowly,fill,fill,slowly,187.1,194.7,7.6,210,209,1,28,64
VT06ntxNAmE_292-300,brush lightly,lightly,brush,brush,gently,292.9,300.1,7.3,194,193,0,8,49
rOzAgEQrYBg_380-386,lightly mix stuff,lightly,mix,mix,gently,380,386.1,6.1,180,179,0,0,7
6NWx-k09gUs_190-196,partially cover cook,partially,cover,cover,partially,190.2,196.1,5.9,180,179,9,9,88
MohhyHgQKRE_131-136,coarsely chop,coarsely,chop,chop,coarsely,131.5,136.5,5.1,151,150,4,1,6
iA8vFYFaFBw_182-196,gently pour raw,gently,pour,pour,gently,182.1,196.2,14.1,350,349,0,3,13
VgE9rsZ-gzM_84-90,pour chocolate into dry ingredients gently,gently,pour,pour,gently,84.5,90.2,5.7,150,149,0,3,13
2sYskJjHhGU_45-55,roll dodo gently,gently,roll,roll,gently,45.2,55.7,10.5,301,300,0,6,19
5fCrlIsOGPg_213-219,toss grapes gently fold,gently,fold,fold,gently,213.9,219.9,6.1,181,180,0,5,5
52NzkqtYFPM_205-211,screw gently squeeze,gently,squeeze,squeeze,gently,205.8,211.2,5.4,180,179,0,16,12
R0onFnX15b8_190-197,cut pistachios thinly,thinly,cut,cut,finely,191,197.2,6.2,175,174,2,11,8
jSn_eq5w3HU_321-330,lightly hands fold into little bottle,lightly,fold,fold,gently,321.7,330,8.3,223,222,0,5,5
1b1ZutQ4TaU_174-184,pepper chop finely,finely,chop,chop,finely,174.6,184.2,9.6,250,249,2,1,18
gGh_a3Xe5XA_156-161,batter stir gently,gently,stir,stir,gently,156.4,161.5,5.1,151,150,0,2,9
mMtJHfqvtPY_34-42,peanuts food processor coarsely grind peanuts add black,coarsely,grind,grind,coarsely,34.8,42.3,7.5,191,190,4,37,98
hDt5VUsk0bQ_441-469,finely chop finely chopped garlic chopped kitchen,finely,chop,chop,finely,441.2,469.8,28.6,701,700,2,1,18
_yMwf3xrjEM_190-195,gently knead dough using push pull,gently,knead,knead,gently,190.6,195.9,5.3,152,151,0,20,69
ACHcWMTttAw_20-26,whisk slowly get sugar,slowly,whisk,whisk,slowly,20.4,26,5.6,181,180,1,7,32
XeeMYKOm9ns_347-353,tell looking gently toss,gently,toss,toss,gently,347.2,353.8,6.7,181,180,0,12,16
7k5i4atJb4g_650-668,start gently flip,gently,flip,flip,gently,650.2,668.2,18,541,540,0,19,36
rcofzaKzLPk_254-265,add boiled beans add coriander leaves mint leaves stir gently,gently,stir,stir,gently,254.4,265.5,11.1,330,329,0,2,9
pmub7sejaZY_243-251,quickly chop celery,quickly,chop,chop,quickly,243.6,252,8.4,200,199,3,1,63
TdthKTEm4og_721-729,spatula lightly pour crust makes pat,lightly,pour,pour,gently,721.1,729.8,8.8,193,192,0,3,13
SIea3cQ9E0M_189-211,mix gently,gently,mix,mix,gently,189.2,212,22.7,550,549,0,0,7
wNrfLOHnn9w_462-468,peel separating slowly attempt,slowly,separate,separate,slowly,462,468.6,6.6,179,178,1,38,110
QdmqLb-xyOc_76-85,lightly grinding garlic lots garlic,lightly,grind,grind,gently,76.6,85.8,9.2,215,214,0,37,157
Vb8fRWtqRmg_248-256,stir gently 20 minutes big bits cut spoon,gently,stir,stir,gently,248,256.3,8.3,242,241,0,2,9
IyqP8pZ-TRo_148-154,test s ready gently press center cake feel firm,gently,press,press,gently,148.4,154,5.7,181,180,0,4,3
SGr2yIbnJyY_92-100,roll quite tightly,tightly,roll,roll,tightly,92,100.6,8.5,201,200,5,6,42
NHCcU--vnEI_199-204,black pepper quickly stir adding,quickly,stir,stir,quickly,199.5,204.8,5.3,149,148,3,2,20
Hwg9Ola5glQ_197-203,good volume mix lightly court oven,lightly,mix,mix,gently,197.8,203.6,5.8,179,178,0,0,7
9kvkhxa3K_w_29-46,cutting chopping begin onions chop roughly,roughly,chop,chop,coarsely,29.2,46.4,17.2,425,424,4,1,6
0IYV4JZwGT4_119-126,press pancakes lightly,lightly,press,press,gently,119.2,126.6,7.4,211,210,0,4,3
mTKLWhM-vUU_184-194,gently good stir break potatoes,gently,stir,stir,gently,184.2,194.1,9.9,301,300,0,2,9
7Iwc8TS6N_A_187-193,slowly fold sides into,slowly,fold,fold,slowly,187.3,193.5,6.2,180,179,1,5,97
VrzOCIUhLHM_282-288,center gently press raw kidney beans,gently,press,press,gently,282.8,288.1,5.3,150,149,0,4,3
bviE38-ISTw_149-154,salt whisk nice frothy slowly,slowly,whisk,whisk,slowly,149.2,154.5,5.3,151,150,1,7,32
ms-vDvA5Izk_105-115,add 1 5 cups milk 1 5 tsp vanilla essence mix vigorously sugar dissolves,vigorously,mix,mix,vigorously,105.6,115.7,10.1,299,298,6,0,109
YUsR9dmTVk4_162-170,press lightly,lightly,press,press,gently,162.8,170.4,7.7,200,199,0,4,3
g8PzRE3niDE_372-383,lightly mix,lightly,mix,mix,gently,372.5,383.1,10.6,330,329,0,0,7
4CVkLInNhTA_130-137,says stir vigorously,vigorously,stir,stir,vigorously,130.5,137.8,7.2,175,174,6,2,53
K2_LQHKvEhw_139-149,butter lightly coat entire,lightly,coat,coat,gently,139.2,149.1,10,300,299,0,15,33
VYBJXf8wgTI_231-241,coarsely grind cloves black pepper add,coarsely,grind,grind,coarsely,231.4,241.3,10,299,298,4,37,98
PfPPFR1_UBo_53-58,gently roll into tube,gently,roll,roll,gently,53,58.9,5.8,126,125,0,6,19
mHffqja43qA_219-229,mixing vigorously,vigorously,mix,mix,vigorously,219.8,229,9.2,151,150,6,0,109
nw-7I0ijSwo_274-279,corners come lightly fold,lightly,fold,fold,gently,274.7,279.9,5.2,121,120,0,5,5
1LWCs6rsQXc_864-869,delicious head meat gently scrape says get into,gently,scrape,scrape,gently,864.3,869.4,5.2,150,149,0,27,55
7NyofZBjyc4_493-498,hardens fridge hard spread lightly,lightly,spread,spread,gently,493.2,498.2,5,150,149,0,13,57
hPbWuyV1p70_244-260,knife break go roughly mix,roughly,mix,mix,coarsely,244.6,260.3,15.7,400,399,4,0,54
I1Uei-zlVJI_450-461,way diagonal chocolate lightly squeeze,lightly,squeeze,squeeze,gently,450,461.8,11.8,329,328,0,16,12
UQu5jVagfao_132-139,doing adding vinegar slowly stirring,slowly,stir,stir,slowly,132.8,139.7,6.9,209,208,1,2,59
P98YZgYYzzg_282-288,go nice smooth start pouring slowly,slowly,pour,pour,slowly,282.7,288.4,5.6,181,180,1,3,11
ySZVzjxZl3o_66-75,lightly whisk,lightly,whisk,whisk,gently,66.6,75.1,8.4,269,268,0,7,17
67Z2521LFb0_344-351,cover tightly,tightly,cover,cover,tightly,344.2,351.8,7.6,210,209,5,9,27
PcU4jDVdZOM_166-174,grind softly small circles,softly,grind,grind,gently,166.7,174.2,7.6,193,192,0,37,157
