seg_id,sentence,adverb_pre_mapping,verb_pre_mapping,clustered_verb,clustered_adverb,start_time,end_time,duration,rgb_frames,flow_frames,adverb_label,verb_label,verb_adv_label
WpXku1Fw40s_205-211,punch get aggression knead quickly,quickly,knead,knead,quickly,205.9,211.1,5.2,144,143,3,20,167
p0OQ443_S30_465-472,gently roll repeat steps pieces,gently,roll,roll,gently,465.9,472.2,6.3,212,211,0,6,19
aBp8YUG3ap4_418-425,gently cutting bars,gently,cut,cut,gently,419,425.9,6.9,175,174,0,11,25
aPde98NbJ0s_206-212,gently mix remember,gently,mix,mix,gently,206.2,212.1,5.9,180,179,0,0,7
Dn-wHuOhB0A_239-245,lightly toss salad,lightly,toss,toss,gently,239.4,245.8,6.4,144,143,0,12,16
Pa2CHXAL-98_121-131,mix roughly add oil turn perfect add,roughly,mix,mix,coarsely,121.7,131.9,10.2,300,299,4,0,54
fkIMdzRvsfQ_489-495,using paper towel place buttercream gently rub smooth,gently,rub,rub,gently,489.9,495.1,5.1,150,149,0,22,21
S_fTjARtDOE_130-139,little baking soda stir slowly add contact lens,slowly,stir,stir,slowly,130.6,139.4,8.9,270,269,1,2,59
9C8AOKvV-RE_163-173,gently fold,gently,fold,fold,gently,163.5,173.4,10,300,299,0,5,5
kOa3LyJAPn4_432-440,spread lightly,lightly,spread,spread,gently,432.4,440.1,7.8,241,240,0,13,57
Q9Z8ucM11wg_164-170,fully mix,fully,mix,mix,completely,164.4,170.6,6.2,180,179,7,0,72
ipxs3GvNw8w_172-180,gently press stuffing make,gently,press,press,gently,172.2,181,8.8,240,239,0,4,3
uHfGdvUQtOY_143-149,things add coriander leaves cut finely using,finely,cut,cut,finely,144,149.4,5.4,150,149,2,11,8
C1cYgC9Kp7U_132-138,whisk quickly heating,quickly,whisk,whisk,quickly,132.7,138.6,5.9,179,178,3,7,102
D9Z0zcE4c2w_304-312,feel free gently press,gently,press,press,gently,304.1,313,8.9,240,239,0,4,3
aBU59tsLhKQ_116-124,oil toss lightly,lightly,toss,toss,gently,116.2,125,8.8,241,240,0,12,16
QA_VnjOUsVM_41-47,grate thinly,thinly,grate,grate,finely,41.5,47.7,6.2,143,142,2,41,71
6Do_oP3qDs0_510-517,spread roll little thinly hands,thinly,spread,spread,finely,510.4,517.7,7.3,176,175,2,13,83
aH2G3HroIKg_716-723,gently stir kurds minutes helps,gently,stir,stir,gently,716.6,723.2,6.5,176,175,0,2,9
qhxpWNfBs5M_559-564,little olive oil brush lightly,lightly,brush,brush,gently,559.6,565,5.4,151,150,0,8,49
nLgkfjSg3gk_78-85,gently mix,gently,mix,mix,gently,79,85,6,211,210,0,0,7
Et8D52i6Q8Y_102-112,slowly mix egg white,slowly,mix,mix,slowly,102.9,112.2,9.3,300,299,1,0,48
-E6ql2Bueyo_157-163,amounts salt boy start feeling gently stirring,gently,stir,stir,gently,157.8,163.2,5.4,182,181,0,2,9
9PLdsc98Nno_151-163,vanilla extract quickly stir,quickly,stir,stir,quickly,151.5,163.1,11.6,300,299,3,2,20
gruVrg-0hAw_166-172,important meal roughly chop,roughly,chop,chop,coarsely,167,172.3,5.3,180,179,4,1,6
oC7ea0XugFA_146-158,half mixture gently mix,gently,mix,mix,gently,146.7,158.9,12.2,301,300,0,0,7
KQprvJzHplc_58-64,eggplants cooled peel skin gently flatten using,gently,flatten,flatten,gently,58.4,64.7,6.3,180,179,0,32,22
qMzBHfeh_Ys_73-79,peel finely grate,finely,grate,grate,finely,73.5,79.4,5.9,180,179,2,41,71
Wz3Y7kV--eg_105-111,chop finely,finely,chop,chop,finely,105.5,111.6,6.1,180,179,2,1,18
zfApZZlta10_151-157,strong adding scrambled eggs quickly mix sesame,quickly,mix,mix,quickly,151.9,157.4,5.6,180,179,3,0,34
CJd3w9ellb8_160-167,gently pour tart,gently,pour,pour,gently,160.3,167,6.7,209,208,0,3,13
l0f1ewjjFus_199-204,loosely cover foil,loosely,cover,cover,loosely,199.1,204.1,5.1,125,124,8,9,107
8NMPLNKZOk4_106-114,mix lightly go mix,lightly,mix,mix,gently,106.6,114.2,7.6,240,239,0,0,7
bhn27efGVpY_67-74,sift flour fold gently,gently,fold,fold,gently,67.2,74.1,6.9,176,175,0,5,5
tYmMEq5MDpc_158-165,stir gently movements,gently,stir,stir,gently,158.7,165.8,7.1,175,174,0,2,9
7zn_TcmPXiI_96-101,cover pot tightly lid crush garlic,tightly,cover,cover,tightly,96.3,101.9,5.6,149,148,5,9,27
m6oHeIdwOcM_378-383,corn tortilla lightly coat,lightly,coat,coat,gently,378.8,383.9,5.1,151,150,0,15,33
URHOOwdplWg_360-365,roll gently into cocoa powder,gently,roll,roll,gently,360.8,365.8,5,151,150,0,6,19
XxpyjTniJqM_55-62,finely chop,finely,chop,chop,finely,55.6,62.1,6.6,175,174,2,1,18
C1HdMZ1E-BA_63-69,press gently squeeze excess water light touch tofu,gently,squeeze,squeeze,gently,63.1,69.4,6.3,179,178,0,16,12
FNXEUk4r4Bs_180-186,lightly mix wow,lightly,mix,mix,gently,180.7,186.2,5.5,181,180,0,0,7
kwF77LrxUxw_198-208,make mess kitchen cup time slowly fold,slowly,fold,fold,slowly,198.9,208.2,9.3,250,249,1,5,97
me_wCPDOb5M_172-180,lightly mix,lightly,mix,mix,gently,173,180.8,7.9,200,199,0,0,7
FqOLWPLBwtg_40-47,biscuit mixture pressing gently refrigerate 2 hours remove,gently,press,press,gently,40.4,47.7,7.3,175,174,0,4,3
r4XepHaVxeA_325-331,gently spoon rest sauce veggie slices,gently,spoon,spoon,gently,325.5,331.5,6,144,143,0,25,10
jDMKromKbTo_92-100,tuna spreading somewhat thinly,thinly,spread,spread,finely,92.3,100.7,8.4,242,241,2,13,83
N1FA_w04LeI_44-50,finely chop green,finely,chop,chop,finely,44.8,50.8,6,180,179,2,1,18
wpKB2cogdHM_286-293,custard starts thicken stir briskly point,briskly,stir,stir,quickly,286.8,293.7,6.9,210,209,3,2,20
CXRVeSHux7Q_120-127,breadcrumb texture gently rub use,gently,rub,rub,gently,121,127.4,6.4,175,174,0,22,21
J0rhLk-WH3Y_743-749,ice lightly drizzle nutella,lightly,drizzle,drizzle,gently,743.9,749.7,5.8,180,179,0,21,137
7wy9nnr0siQ_69-78,mix vigorously adds,vigorously,mix,mix,vigorously,70,78.2,8.2,270,269,6,0,109
b_dzxRI-uI0_618-652,pressing gently,gently,press,press,gently,618.1,648.1,31,881,880,0,4,3
Ao6hzJ07vMo_532-538,way come bozek's good doing mixing slowly,slowly,mix,mix,slowly,532.8,538.6,5.8,145,144,1,0,48
1Egs6nFcUiM_356-380,apple pie graph half dough gently cover,gently,cover,cover,gently,356.8,380.7,23.8,722,721,0,9,14
Gtt48aoIfFg_122-129,cut coarsely carrots,coarsely,cut,cut,coarsely,122.6,129.6,7,175,174,4,11,28
nhDl8pgF67Q_194-203,push gently squeeze lift,gently,push,push,gently,194.1,203.6,9.5,269,268,0,10,50
_PKPgc-7Eyc_168-176,paper towel lightly dip,lightly,dip,dip,gently,168.6,176.5,8,241,240,0,31,100
EQYdN9BcPVA_158-168,mix gently,gently,mix,mix,gently,158.2,168.1,9.9,299,298,0,0,7
ooY1RtaqGAo_322-328,roll gently comment picture,gently,roll,roll,gently,322.9,328.9,6,181,180,0,6,19
e0Wca7dzFiI_267-290,cutting loaf thinly,thinly,cut,cut,finely,267.4,290.1,22.8,575,574,2,11,8
SRkq3ARV6qw_117-134,finely chop coriander,finely,chop,chop,finely,117.7,134,16.4,510,509,2,1,18
abtYBvUE0p4_25-31,lightly coat 9 inch pie plate nonstick cooking spray,lightly,coat,coat,gently,25.9,31.4,5.5,144,143,0,15,33
XBMsT5aTm70_103-111,olive oil lightly brush,lightly,brush,brush,gently,103.9,111.1,7.2,194,193,0,8,49
JTO_GYcH2eM_272-281,press lightly seeds help,lightly,press,press,gently,272,281.8,9.8,270,269,0,4,3
bm0Jpuk113I_59-67,filling slowly easiest,slowly,fill,fill,slowly,59.3,67.4,8.1,239,238,1,28,64
ZAR7iNt7MZA_428-435,dough gently roll,gently,roll,roll,gently,428.1,435.5,7.4,176,175,0,6,19
iBCAW3CNLTQ_585-593,lightly dust powdered sugar little powdered sugar snow,lightly,dust,dust,gently,585.2,593.6,8.3,192,191,0,33,31
QSTOeRRntvI_53-66,mixture gently fold spin,gently,fold,fold,gently,53.9,66.5,12.6,325,324,0,5,5
Cbkac_uFEYA_176-183,chives finely chop,finely,chop,chop,finely,176.6,183.8,7.3,176,175,2,1,18
r9r14WjFtyo_148-156,roll gently press yes perfect,gently,press,press,gently,148.5,156.1,7.6,240,239,0,4,3
lE7tiyhoLVM_315-339,add half gently mixing,gently,mix,mix,gently,315.7,340,24.3,721,720,0,0,7
kM1vp8NVY-g_54-59,lightly crack egg shell,lightly,crack,crack,gently,54,59.3,5.2,150,149,0,44,61
mJYUhS4b6lw_107-113,toss gently avoid paneer breaking,gently,toss,toss,gently,108,113.1,5.1,150,149,0,12,16
pfhVCwj2WdE_105-111,wrap tightly aluminum foil,tightly,wrap,wrap,tightly,105.6,111.2,5.6,144,143,5,17,29
6T_V7GY8m78_181-190,bowl gently mix 2 cups flour,gently,mix,mix,gently,181.7,190.8,9.1,270,269,0,0,7
nlR0AEJFCHI_112-117,gently fold make mix dough,gently,fold,fold,gently,112.6,118,5.3,150,149,0,5,5
C_boUtv30jI_95-104,sliced ham quickly stir,quickly,stir,stir,quickly,95.4,105,9.6,226,225,3,2,20
9QfRoeXvmgs_62-71,roast 30 minutes gently shaking tray 10 minutes cut,gently,shake,shake,gently,62.7,72,9.3,225,224,0,24,40
rjqOTM5icOE_129-134,start pour nice slowly,slowly,pour,pour,slowly,129.2,134.6,5.5,122,121,1,3,11
icCJLkP9Yz8_163-171,lightly dip crepe maker into batter pick batter,lightly,dip,dip,gently,163.1,171.8,8.7,240,239,0,31,100
kRy4-fCcdpM_42-53,quickly chop 3 4 cup onion,quickly,chop,chop,quickly,43,53.1,10.1,330,329,3,1,63
bZpoKRYGCAA_754-764,basil sauce lightly pour manicotti,lightly,pour,pour,gently,754.1,764.7,10.6,302,301,0,3,13
DuS13zG50lM_113-119,slowly mix egg,slowly,mix,mix,slowly,113.3,119.4,6.2,182,181,1,0,48
LEjiI0y1GYQ_175-180,tortilla fold tortilla into square tightly place folded,tightly,fold,fold,tightly,175.2,180.5,5.3,151,150,5,5,44
pr5L_3t0zeI_108-115,cut onion finely,finely,cut,cut,finely,108.2,115.1,6.9,211,210,2,11,8
EtiQgzndnos_447-458,cook low flame pressing gently gets brown spots sides,gently,press,press,gently,447.7,458.8,11.1,277,276,0,4,3
KiZfxq-ZyWI_54-59,gently flatten using meat,gently,flatten,flatten,gently,54.8,60,5.2,150,149,0,32,22
PKM91jn1Fe8_70-76,slowly mix flour mixture into egg,slowly,mix,mix,slowly,70.2,76.5,6.3,180,179,1,0,48
RKh7xVpjgq8_124-141,little spoon press gently,gently,press,press,gently,124.4,141.1,16.7,511,510,0,4,3
es6KcOm-ZP4_383-389,add rest whipped cream fold gently,gently,fold,fold,gently,384,389.1,5.2,150,149,0,5,5
rut9yVeGgeI_104-113,maple syrup gently stir,gently,stir,stir,gently,104.6,113.6,8.9,270,269,0,2,9
bBDZURItFqc_528-535,quickly stir green onions,quickly,stir,stir,quickly,528.1,535.9,7.8,211,210,3,2,20
SzZhDmEh6Z4_93-99,gently rolling pin,gently,roll,roll,gently,93.8,100,6.2,180,179,0,6,19
OaGaQuzqoc8_54-60,chopping board finely dice,finely,chop,chop,finely,54.5,60.8,6.3,145,144,2,1,18
RZTz0U7gZbM_85-90,quickly chop chili,quickly,chop,chop,quickly,85.4,90.4,5,125,124,3,1,63
z6699GgqECk_528-534,loosely fold,loosely,fold,fold,loosely,528.6,534.6,6,180,179,8,5,139
YWePJ5QFgRw_1056-1065,begins steam start slowly mixing snow,slowly,mix,mix,slowly,1056.6,1065.4,8.8,272,271,1,0,48
YIjbmEZtu7s_16-25,gently mix add salt ha ha,gently,mix,mix,gently,16.6,25.8,9.2,262,261,0,0,7
wPEwF2HS15Y_153-166,vanilla point gently stir,gently,stir,stir,gently,153.9,166.2,12.3,313,312,0,2,9
vUmJDIoYvHA_75-87,finely chop greens,finely,chop,chop,finely,76,87.1,11.1,288,287,2,1,18
UmemVqN8DSE_209-214,get finely chop rosemary add leaves lemon,finely,chop,chop,finely,209.2,214.8,5.6,121,120,2,1,18
aHz8uqrAju0_322-329,lightly grease cookie sheet make,lightly,grease,grease,gently,322.2,329.4,7.1,210,209,0,29,75
EZ84_hWsypw_180-188,gently fold,gently,fold,fold,gently,180.3,188.1,7.8,240,239,0,5,5
PkzIKfSH7rA_179-189,gently push bases into,gently,push,push,gently,179.8,189.1,9.3,241,240,0,10,50
4BkEX-U_ZSg_134-141,vegetable stock roughly chop peanuts,roughly,chop,chop,coarsely,134,141.6,7.6,176,175,4,1,6
d7uY9JtT4FE_465-472,pat gently make,gently,pat,pat,gently,465.8,472.1,6.3,170,169,0,30,23
xbHwk_PvfkU_90-97,come beat vigorously,vigorously,beat,beat,vigorously,90.1,97.9,7.9,175,174,6,14,129
0HsEZL5_yAk_458-464,add 1 4 cream stir vigorously point,vigorously,stir,stir,vigorously,458.6,464.7,6.1,143,142,6,2,53
18am-cr0yG0_55-61,cut slowly half,slowly,cut,cut,slowly,55.3,61.9,6.6,144,143,1,11,78
ThEdHTTpfmY_71-76,pineapples added course long grain rice mix gently,gently,mix,mix,gently,71.2,76.9,5.7,149,148,0,0,7
4dXc-XRXWh4_423-428,dried problem chop finely throw add salt,finely,chop,chop,finely,423.1,428.2,5.1,151,150,2,1,18
K60DcxBCe7E_289-300,gently scrape desert fish scrape,gently,scrape,scrape,gently,289.8,300.9,11.2,330,329,0,27,55
a0jhPJAfblE_152-166,roughly chop spinach slice ties,roughly,chop,chop,coarsely,152.3,166.1,13.8,350,349,4,1,6
zC9X4li_Fa4_123-131,skin face skin lips massaging gently,gently,massage,massage,gently,123.1,131.8,8.7,240,239,0,47,115
CHXq6gOOYng_246-252,pound raspberries gently fold break,gently,fold,fold,gently,246.8,252.4,5.6,150,149,0,5,5
HnVIdJA6gEE_231-238,slowly pour,slowly,pour,pour,slowly,231.9,238.1,6.2,211,210,1,3,11
SvSNYn1PcZo_504-515,slowly spread pesto nice nice nice,slowly,spread,spread,slowly,504.5,515.7,11.3,330,329,1,13,121
E4ZoSN_wjNI_146-152,into egg butter mix add pineapple slowly mix,slowly,mix,mix,slowly,146.7,153,6.3,145,144,1,0,48
wpNtJBvhLfg_366-373,finely chop lap rowen,finely,chop,chop,finely,366.4,373.5,7.1,210,209,2,1,18
Y9gvBajCaZ4_47-52,breadcrumbs walnuts parsley oil lightly press mixture fish,lightly,press,press,gently,47.4,52.7,5.2,150,149,0,4,3
FtwmWN6S_cI_444-452,flour quickly press add little,quickly,press,press,quickly,444.7,452.2,7.5,240,239,3,4,127
rvCCvNodRjQ_158-164,caramelizing onions remember slowly stir onions,slowly,stir,stir,slowly,158,164,6.1,180,179,1,2,59
2yL9AgrAFCw_125-131,rolling pin gently roll,gently,roll,roll,gently,125.8,131.3,5.6,181,180,0,6,19
NeEHN8jH30g_87-92,slowly press finger,slowly,press,press,slowly,87.6,92.7,5.1,126,125,1,4,99
nYmgm_cnbXg_180-187,eggs into big bowl quickly whisk eggs,quickly,whisk,whisk,quickly,180.1,188,7.8,210,209,3,7,102
XbegMNSpEb4_431-457,tie cloth tightly,tightly,tie,tie,tightly,431.6,457,25.4,780,779,5,46,30
rE-VUPG0sUU_159-165,lightly coating melted,lightly,coat,coat,gently,159.5,165.5,6,150,149,0,15,33
TlzVUIMI6gk_183-190,whisk whisking lightly,lightly,whisk,whisk,gently,183.9,190.3,6.4,212,211,0,7,17
PMs0V4AETEc_367-377,neon gently stir kurds 20 minutes,gently,stir,stir,gently,367.5,377.6,10.1,250,249,0,2,9
mtX7BxxH-sk_67-72,finely chop parsley,finely,chop,chop,finely,67,72.8,5.8,120,119,2,1,18
LfxKEHagiXw_578-585,make water come cheesecake wrap tightly,tightly,wrap,wrap,tightly,578,585.3,7.3,210,209,5,17,29
MB8V1YuZrlw_207-216,spread gently spoon,gently,spread,spread,gently,207.2,216.7,9.4,225,224,0,13,57
dQX9my6sBXU_572-578,stir quickly,quickly,stir,stir,quickly,572.4,578.4,5.9,180,179,3,2,20
cu1GPuvQl-s_377-383,gently fold time,gently,fold,fold,gently,377.2,383.3,6.2,150,149,0,5,5
vR5eLpASOYI_156-173,quickly way peel potato skin mess,quickly,peel,peel,quickly,156.4,173.3,16.8,510,509,3,18,86
0IuAOaQki0o_68-73,butter slowly stir sugar,slowly,stir,stir,slowly,68.1,73.4,5.3,120,119,1,2,59
AOh0-zd2k7o_43-50,350 degrees finely chop,finely,chop,chop,finely,43.6,50.6,6.9,175,174,2,1,18
KvS1XK1eg_I_417-423,gently good stir,gently,stir,stir,gently,417.3,423.6,6.2,180,179,0,2,9
KFVbw-NwwTM_68-85,sweet corn sweet corn grains mixer coarsely grind,coarsely,grind,grind,coarsely,68.4,85.2,16.8,426,425,4,37,98
L0keWUW0Cr4_409-416,gently toss lao beef salad,gently,toss,toss,gently,409.1,416.6,7.4,209,208,0,12,16
XVcjmiKn1DY_1019-1045,seasoning gently tune,gently,season,season,gently,1019.6,1045.6,26,650,649,0,35,38
xwzAEz02_9k_101-110,d chopped carrots mix gently,gently,mix,mix,gently,101.5,110,8.5,226,225,0,0,7
L3p8N8n8DUw_35-44,6 roughly chop i'd clamp slice,roughly,chop,chop,coarsely,35,44.1,9,225,224,4,1,6
NY0aQJmmTT4_64-71,cut finely,finely,cut,cut,finely,64.8,71.8,7,175,174,2,11,8
S6x_dEm5QQc_263-269,slowly pour base into soap mold create layer,slowly,pour,pour,slowly,263.8,269.2,5.4,179,178,1,3,11
bOD0gEmnTGI_90-96,gently fold,gently,fold,fold,gently,90.9,96.2,5.3,180,179,0,5,5
YK0vwL9NzPI_261-267,liquid roof start slowly mixing,slowly,mix,mix,slowly,261.1,267.2,6.1,180,179,1,0,48
bu09k7gmgpM_240-246,water meringue powder lightly brush little,lightly,brush,brush,gently,240.8,246.2,5.3,180,179,0,8,49
kXFfcxh-qKY_129-140,lightly press bake 375,lightly,press,press,gently,129.8,140.4,10.6,331,330,0,4,3
dATnwf8XpfU_148-157,puff pastry time roll roll roll gently,gently,roll,roll,gently,148.4,157.8,9.4,272,271,0,6,19
9SkHVkRmtUY_631-638,flip pieces slowly spatula,slowly,flip,flip,slowly,631.7,638.2,6.4,210,209,1,19,84
vDW1uXc3vKA_37-57,1 cup water pour flour into mixing bowl slowly introduce water,slowly,pour,pour,slowly,37.9,57.2,19.3,601,600,1,3,11
huxIXmAm74w_172-181,drizzle lightly y'all fall,lightly,drizzle,drizzle,gently,172.9,181.5,8.6,272,271,0,21,137
jVcRAa_KVw4_56-66,grab rolling pin gently roll,gently,roll,roll,gently,56.6,66.9,10.2,300,299,0,6,19
s6h_6CV80Jw_137-147,add flour flour helps thicken cut stir quickly,quickly,stir,stir,quickly,137.2,147.7,10.5,300,299,3,2,20
r_UsJaxDISY_701-706,fully stir granules source s2 wallet,fully,stir,stir,completely,701.1,706.7,5.6,150,149,7,2,85
q3GUNWz0J4M_161-168,makes quickly spoon,quickly,spoon,spoon,quickly,161.1,169,7.8,210,209,3,25,65
fnQW4aRES_g_166-173,stir moon slowly,slowly,stir,stir,slowly,166.6,173.2,6.6,209,208,1,2,59
uCo_-qpk6es_460-466,gently toss absorb,gently,toss,toss,gently,460.4,466.4,5.9,150,149,0,12,16
epO3fhpbRKY_157-171,cumin seeds press gently,gently,press,press,gently,157.9,171,13.1,420,419,0,4,3
El1eM5g_un4_580-588,camera gently fold times absorb flavor,gently,fold,fold,gently,580.1,588,7.9,192,191,0,5,5
i-TAfCQ62q0_156-162,cut into thin slices gently,gently,cut,cut,gently,156.3,162.1,5.9,182,181,0,11,25
YV_Mr6QLqIM_265-285,gently spoon pavlova using spatula spread,gently,spoon,spoon,gently,265.9,285.9,19.9,599,598,0,25,10
y0kS7R5lPvc_65-74,blender mixture slowly pouring,slowly,pour,pour,slowly,65.1,74.5,9.4,269,268,1,3,11
uD4DbiE6GG0_107-113,question cutting folding nice lightly,lightly,fold,fold,gently,107.4,113.5,6.1,150,149,0,5,5
zDaATLigQq0_1058-1071,lightly spray baking pan,lightly,spray,spray,gently,1058.6,1071.6,13,389,388,0,23,43
utykQkmUIvs_181-307,start gently mixing dressing potatoes,gently,mix,mix,gently,198.2,238.2,41,689,688,0,0,7
2osD3rwnJm8_543-552,spoon gently into greased ramekin dishes got little,gently,spoon,spoon,gently,543.2,552,8.8,225,224,0,25,10
0KFmXmrIX_c_281-288,whisking vigorously eggs,vigorously,whisk,whisk,vigorously,281.4,288.1,6.8,176,175,6,7,1
uGfWbbPgm-c_71-78,finely mince,finely,mince,mince,finely,71.6,78.1,6.5,210,209,2,26,0
gDtyO1DoeeU_208-215,count seconds stir gently,gently,stir,stir,gently,208.8,215.7,6.8,176,175,0,2,9
HiiWplgHWFk_472-477,expand edges gently roll reason,gently,roll,roll,gently,472.4,477.4,5.1,150,149,0,6,19
bGJeOGlQ1MQ_166-172,slowly fold,slowly,fold,fold,slowly,166.8,172.8,6,179,178,1,5,97
6NgheY-r5t0_270-275,roughly chop fresh herbs,roughly,chop,chop,coarsely,270.8,275.8,5,125,124,4,1,6
NkMFNepkPds_298-305,start gently pushing,gently,push,push,gently,298.2,305.8,7.7,169,168,0,10,50
5-7FliKQPkA_329-336,cover loosely lid,loosely,cover,cover,loosely,329.6,336.7,7.1,175,174,8,9,107
gfMbzfwm_ME_25-35,chopped 1 green bell pepper finely chop,finely,chop,chop,finely,25.8,35.6,9.8,300,299,2,1,18
lLlDK_1un4Y_65-71,stir slowly hurry,slowly,stir,stir,slowly,65.7,71.5,5.9,151,150,1,2,59
MZ2Ccew23wo_463-472,posting allows roughly chop things weird,roughly,chop,chop,coarsely,463.5,472.3,8.8,269,268,4,1,6
rChqq9cyRP4_96-101,stir slowly figure what's happen begins separate,slowly,stir,stir,slowly,96.1,101.8,5.7,150,149,1,2,59
UjaQKb31PBk_72-86,finely mince,finely,mince,mince,finely,72.4,86.4,14,420,419,2,26,0
b5NLWdDkOD4_64-71,spray spray lightly,lightly,spray,spray,gently,64.7,71.1,6.4,209,208,0,23,43
ztmcas3pq7E_244-252,gently roll,gently,roll,roll,gently,244.2,252.3,8.1,201,200,0,6,19
o3I1gobIucI_190-201,quickly pour tree,quickly,pour,pour,quickly,190.6,201.9,11.2,275,274,3,3,66
WahyJCf94e0_405-411,lightly rub flip peel mat,lightly,rub,rub,gently,405.8,411,5.2,182,181,0,22,21
fJZO_EA2cwU_201-208,slowly mix paste meal,slowly,mix,mix,slowly,201.2,208.1,6.9,211,210,1,0,48
q9VG_lcrQPI_39-44,cut half sweet pepper into medium sized strips finely chop 1 tablespoon chives,finely,cut,cut,finely,39.6,44.9,5.3,150,149,2,11,8
2EG5eZQqIKU_157-163,tie tightly tie,tightly,tie,tie,tightly,157,163.8,6.7,180,179,5,46,30
rpI-9FUWJ-A_52-58,turn mixer slowly pour,slowly,pour,pour,slowly,52.4,58,5.6,144,143,1,3,11
2pUDI-9QR5M_172-178,toss gently incorporate absolutely gorgeous,gently,toss,toss,gently,172,178.5,6.5,180,179,0,12,16
rhQafk84g0E_279-286,whisk quicker heat gently,gently,whisk,whisk,gently,279.6,286.1,6.4,175,174,0,7,17
yAlMc7sEiI0_138-144,gently fold,gently,fold,fold,gently,138.5,144.9,6.4,150,149,0,5,5
FreqTzIdj1Q_277-288,way slices cover loosely fold,loosely,fold,fold,loosely,277.8,288.6,10.7,330,329,8,5,139
eSOnGNhZ2wM_30-35,peel cucumber's slice thinly add large bowl,thinly,peel,peel,finely,30.1,35.7,5.6,149,148,2,18,58
G4iMvI48n3Y_441-447,gently stir spatula start,gently,stir,stir,gently,441.5,447.2,5.7,181,180,0,2,9
yrLRPwPsZMw_43-50,butter lightly spray cooking spray tortilla shell sorry,lightly,spray,spray,gently,43.7,50.4,6.7,210,209,0,23,43
3MauXzs6YCw_78-85,heat setting lowest start stirring gently,gently,stir,stir,gently,78.9,85.3,6.4,175,174,0,2,9
xXhU2RHl7r0_429-440,cover baby tightly preheat oven round 350,tightly,cover,cover,tightly,430,440.3,10.3,165,164,5,9,27
9Pep6uJVptE_10-16,cut half quickly,quickly,cut,cut,quickly,10.9,16.7,5.9,150,149,3,11,52
AaoiPppRfnk_177-183,gently brush bees they'll fall hive,gently,brush,brush,gently,177.4,183.9,6.5,181,180,0,8,49
gZlR_73v_kA_194-201,quickly peel cut into small cubes got onion,quickly,peel,peel,quickly,194.2,201,6.9,209,208,3,18,86
KH_Dc8wEUI0_142-149,lightly grease big bowl dough,lightly,grease,grease,gently,142.2,149.9,7.7,175,174,0,29,75
Z90Q1Ex-lPs_70-76,scrape floured surface lightly knead comes,lightly,scrape,scrape,gently,70.2,76.9,6.8,151,150,0,27,55
ShPFLJvgZdo_278-292,cream fold gently,gently,fold,fold,gently,278.6,292.9,14.3,350,349,0,5,5
5DBUnBjxeHA_72-78,pour milk slowly,slowly,pour,pour,slowly,72.5,78.5,6,182,181,1,3,11
IVj5vBHDaQg_231-239,use beaters point trying lightly mix,lightly,mix,mix,gently,231.4,240,8.5,240,239,0,0,7
T-6okeK1Nl8_140-151,quickly dip,quickly,dip,dip,quickly,140.1,151.8,11.7,330,329,3,31,117
1tD6zvZxhCE_164-171,slowly pour eggs,slowly,pour,pour,slowly,164.9,171.2,6.3,168,167,1,3,11
ysQlg3x6s0E_14-23,wet fold bag newspaper wrap tightly plate,tightly,wrap,wrap,tightly,14.2,23.4,9.2,270,269,5,17,29
nqLgyv2XKGk_941-947,gently toss lettuce,gently,toss,toss,gently,941.6,947.4,5.9,180,179,0,12,16
I5JyZkEfmeY_225-232,slowly mixing adding,slowly,mix,mix,slowly,225.8,232.3,6.5,211,210,1,0,48
qJCEYXxj-qU_217-224,gently mix,gently,mix,mix,gently,217.6,224.5,6.9,210,209,0,0,7
AuNq9_TrGGY_150-161,lightly mix,lightly,mix,mix,gently,150.3,161.6,11.3,265,264,0,0,7
K_OSH5b02Y0_298-344,sticking release air dome lightly kneading,lightly,knead,knead,gently,298.8,333.8,36,1061,1060,0,20,69
RG4nD28ewZg_196-216,gently peel hex paper,gently,peel,peel,gently,196.5,216.4,19.9,600,599,0,18,15
7V-BFgsV84o_359-371,finely mince,finely,mince,mince,finely,359,371.4,12.4,360,359,2,26,0
CigK01yOKgo_89-94,slowly whisk sugar,slowly,whisk,whisk,slowly,89,94.5,5.4,120,119,1,7,32
Afa7AkMRhPo_298-304,remember gently folding shape bake,gently,fold,fold,gently,298.3,304.2,5.9,179,178,0,5,5
TB-uVi_3nEw_326-338,gently fold,gently,fold,fold,gently,326.6,338.4,11.8,360,359,0,5,5
R8Ky_EMI6tk_148-154,gently push chocolates get halves,gently,push,push,gently,148.9,154.9,6,180,179,0,10,50
ESJRqDHcYXk_62-68,bowl crack eggs lightly whisk add eggs yeast,lightly,whisk,whisk,gently,62.9,68.1,5.2,179,178,0,7,17
bQuJdER8ltY_205-211,crispy gently dip onions,gently,dip,dip,gently,205.2,211.7,6.5,91,90,0,31,100
CEyBxubfiZ8_212-217,gently press middle,gently,press,press,gently,212.2,217.6,5.4,126,125,0,4,3
jLtyuOVTtek_362-368,gently press sides,gently,press,press,gently,362.3,368,5.8,180,179,0,4,3
mxuUbPdVsnI_86-98,add butter condensed milk mixture little time mix slowly,slowly,mix,mix,slowly,86.4,98.1,11.8,360,359,1,0,48
XIxxgR8c7e0_339-345,spread gently pie,gently,spread,spread,gently,339.4,345.6,6.2,180,179,0,13,57
KE-WkMflS7k_153-162,tightly roll,tightly,roll,roll,tightly,153.3,162.4,9.1,270,269,5,6,42
dpAmKhKIpyA_116-123,roughly mix leave,roughly,mix,mix,coarsely,116.9,123.5,6.6,175,174,4,0,54
lAhOv-xpoic_25-31,medium high slowly stir water,slowly,stir,stir,slowly,26,31.1,5.1,180,179,1,2,59
lSVAzM29KAI_87-94,finely chop,finely,chop,chop,finely,87.3,94.7,7.4,210,209,2,1,18
0pTe64FjgZ8_79-84,pepper capsicum grate vegetables finely,finely,grate,grate,finely,79.2,84.2,5.1,152,151,2,41,71
e6HV9S1oQzg_106-112,elderflower worship nice packet gently massage juice sterilizing,gently,massage,massage,gently,106.5,112.2,5.7,151,150,0,47,115
6byNWZfSnNE_32-39,quickly wash under running water,quickly,wash,wash,quickly,32.7,39.9,7.2,175,174,3,39,24
xPZBB8RWiYo_42-64,start chopping vegetables roughly,roughly,chop,chop,coarsely,42.8,64.5,21.8,528,527,4,1,6
JkW0FXEYEA0_120-131,stuck burn stir fully,fully,stir,stir,completely,120.9,131.2,10.3,330,329,7,2,85
ktxBooJlceE_77-84,roll palms gently ends turn pointy thick middle,gently,roll,roll,gently,77.1,84.4,7.4,211,210,0,6,19
-KeucxgYv2s_82-89,roughly chop basil,roughly,chop,chop,coarsely,82.9,89.2,6.4,168,167,4,1,6
2_RhQnKNG90_201-211,quickly flip,quickly,flip,flip,quickly,201.7,211.7,10,240,239,3,19,93
CNiLSnIZlu0_361-371,spoon gently mix mix ingredients combined,gently,mix,mix,gently,361.7,371.8,10.1,240,239,0,0,7
LdiZUNNtdSk_477-491,tomatoes produce lot liquid cover loosely silver foil,loosely,cover,cover,loosely,477.8,491.4,13.6,350,349,8,9,107
L1KqIEJaIRk_579-586,gently push,gently,push,push,gently,579.1,586.8,7.7,211,210,0,10,50
9mJTxC0rQhs_105-110,use big tablespoon slowly scrape insides,slowly,scrape,scrape,slowly,105.3,110.5,5.2,150,149,1,27,128
EfJ6iQhM1NE_55-65,bench making life lot easier roughly chop,roughly,chop,chop,coarsely,55.8,65.1,9.2,251,250,4,1,6
gksu_uw9l4g_302-307,slowly mix,slowly,mix,mix,slowly,302,307.3,5.3,126,125,1,0,48
f9Abd96pKKg_427-433,turn simmer simmer partially cover,partially,cover,cover,partially,427.3,433.5,6.2,182,181,9,9,88
LG9uEBT2rAY_195-201,gently squeeze milk,gently,squeeze,squeeze,gently,195.1,201.7,6.6,144,143,0,16,12
SRjb5AC_2ho_1-6,yolks whisk vigorously make,vigorously,whisk,whisk,vigorously,27,32.5,5.5,181,180,6,7,1
Z2PvhT_fvQE_127-133,rolling pin gently flatten bread slices bread slices,gently,flatten,flatten,gently,127,133.3,6.3,180,179,0,32,22
